,title,price,rating,availability
523,Memoirs of a Geisha,£49.67,Three,In stock
524,Like Never Before (Walker ...,£28.77,Two,In stock
525,Life of Pi,£13.22,Four,In stock
526,Leave This Song Behind: ...,£51.17,Five,In stock
527,King's Folly (The Kinsman ...,£39.61,Five,In stock
528,John Adams,£57.43,Four,In stock
529,How to Cook Everything ...,£46.01,Four,In stock
530,How to Be a ...,£28.25,Two,In stock
531,Good in Bed (Cannie ...,£37.05,Five,In stock
532,"Fruits Basket, Vol. 7 ...",£19.57,One,In stock
533,For the Love: Fighting ...,£45.13,Three,In stock
534,Finding God in the ...,£46.64,Two,In stock
535,Every Heart a Doorway ...,£12.16,Five,In stock
536,Delivering the Truth (Quaker ...,£20.89,Four,In stock
537,Counted With the Stars ...,£17.97,Five,In stock
538,"Chronicles, Vol. 1",£52.60,Two,In stock
539,Blue Like Jazz: Nonreligious ...,£25.77,One,In stock
540,Benjamin Franklin: An American ...,£48.19,Three,In stock
541,At The Existentialist Café: ...,£29.93,Five,In stock
542,A Summer In Europe,£44.34,Two,In stock
543,A Short History of ...,£52.40,Five,In stock
544,A Gathering of Shadows ...,£44.81,Four,In stock
545,The Sound Of Love,£57.84,Five,In stock
546,The Rise and Fall ...,£39.67,Two,In stock
547,The Perks of Being ...,£55.02,Three,In stock
548,The Mysterious Affair at ...,£24.80,Four,In stock
549,The Man Who Mistook ...,£59.45,Four,In stock
550,The Makings of a ...,£31.58,Two,In stock
551,The Joy of Cooking,£43.27,Four,In stock
552,The Invention of Wings,£37.34,One,In stock
553,The Hobbit (Middle-Earth Universe),£17.80,Five,In stock
554,The Great Railway Bazaar,£30.54,One,In stock
555,The Golden Compass (His ...,£18.77,One,In stock
556,The God Delusion,£46.85,Three,In stock
557,The Girl You Left ...,£15.79,One,In stock
558,The Fellowship of the ...,£10.27,Two,In stock
559,The Collected Poems of ...,£15.42,Five,In stock
560,The Barefoot Contessa Cookbook,£59.92,Five,In stock
561,Tell the Wolves I'm ...,£50.96,Two,In stock
562,Ship Leaves Harbor: Essays ...,£30.60,Three,In stock
563,Pride and Prejudice,£19.27,Four,In stock
564,Musicophilia: Tales of Music ...,£46.58,One,In stock
565,Mere Christianity,£48.51,Three,In stock
566,Me Before You (Me ...,£19.02,One,In stock
567,In the Woods (Dublin ...,£38.38,Two,In stock
568,In Cold Blood,£49.98,Four,In stock
569,How to Stop Worrying ...,£46.49,Five,In stock
570,Give It Back,£18.32,Two,In stock
571,"Girl, Interrupted",£42.14,Three,In stock
572,Fun Home: A Family ...,£56.59,Four,In stock
573,"Fruits Basket, Vol. 6 ...",£20.96,Four,In stock
574,Deception Point,£40.32,Four,In stock
575,"Death Note, Vol. 6: ...",£36.39,Three,In stock
576,Catherine the Great: Portrait ...,£58.55,Four,In stock
577,Better Homes and Gardens ...,£39.61,Three,In stock
578,An Unquiet Mind: A ...,£21.30,Three,In stock
579,A Year in Provence ...,£56.88,Four,In stock
580,World Without End (The ...,£32.97,Four,In stock
581,"Will Grayson, Will Grayson ...",£47.31,Four,In stock
582,Why Save the Bankers?: ...,£48.67,Two,In stock
583,Where She Went (If ...,£41.73,Four,In stock
584,What If?: Serious Scientific ...,£53.68,Four,In stock
585,Two Summers,£14.64,One,In stock
586,This Is Your Brain ...,£38.40,One,In stock
587,The Secret Garden,£15.08,Four,In stock
588,The Raven King (The ...,£30.57,Two,In stock
589,The Raven Boys (The ...,£57.74,Four,In stock
590,The Power Greens Cookbook: ...,£11.05,Five,In stock
591,The Metamorphosis,£28.58,One,In stock
592,The Mathews Men: Seven ...,£42.91,Five,In stock
593,The Little Paris Bookshop,£24.73,Three,In stock
594,The Hiding Place,£55.91,Four,In stock
595,The Grand Design,£13.76,Three,In stock
596,The Firm,£45.56,Three,In stock
597,The Fault in Our ...,£47.22,One,In stock
598,The False Prince (The ...,£56.00,Five,In stock
599,The Expatriates,£44.58,Two,In stock
600,The Dream Thieves (The ...,£34.50,One,In stock
601,The Darkest Corners,£11.33,Five,In stock
602,The Crossover,£38.77,Four,In stock
603,The 5th Wave (The ...,£11.83,Two,In stock
604,Tell the Wind and ...,£45.51,Three,In stock
605,Tell Me Three Things,£41.81,One,In stock
606,Talking to Girls About ...,£25.15,Four,In stock
607,Siddhartha,£34.22,Five,In stock
608,Shiver (The Wolves of ...,£16.23,Five,In stock
609,Remember Me?,£11.48,Three,In stock
610,Red Dragon (Hannibal Lecter ...,£23.37,Three,In stock
611,Peak: Secrets from the ...,£16.28,Two,In stock
612,My Mother Was Nuts,£31.63,Four,In stock
613,Mexican Today: New and ...,£24.91,Five,In stock
614,Maybe Something Beautiful: How ...,£22.54,One,In stock
615,Lola and the Boy ...,£23.63,Four,In stock
616,Logan Kade (Fallen Crest ...,£13.12,Two,In stock
617,Last One Home (New ...,£59.98,Three,In stock
618,Killing Floor (Jack Reacher ...,£31.49,Four,In stock
619,Kill the Boy Band,£15.52,Five,In stock
620,Isla and the Happily ...,£48.13,Five,In stock
621,If I Stay (If ...,£38.13,Five,In stock
622,I Know Why the ...,£36.55,Two,In stock
623,Harry Potter and the ...,£23.32,One,In stock
624,"Fruits Basket, Vol. 5 ...",£16.33,One,In stock
625,Foundation (Foundation (Publication Order) ...,£32.42,One,In stock
626,Fool Me Once,£16.96,One,In stock
627,Find Her (Detective D.D. ...,£22.37,One,In stock
628,Evicted: Poverty and Profit ...,£42.27,One,In stock
629,Drama,£38.70,Two,In stock
630,Dracula the Un-Dead,£35.63,Five,In stock
631,Digital Fortress,£58.00,Five,In stock
632,"Death Note, Vol. 5: ...",£52.41,One,In stock
633,"Data, A Love Story: ...",£32.35,Three,In stock
634,Critique of Pure Reason,£20.75,One,In stock
635,Booked,£17.49,Five,In stock
636,"Blue Lily, Lily Blue ...",£34.13,Five,In stock
637,Approval Junkie: Adventures in ...,£58.81,Five,In stock
638,An Abundance of Katherines,£10.00,Five,In stock
639,America's War for the ...,£51.22,Two,In stock
640,Alight (The Generations Trilogy ...,£58.59,Four,In stock
641,A Girl's Guide to ...,£31.30,One,In stock
642,A Game of Thrones ...,£46.42,Two,In stock
643,A Feast for Crows ...,£17.21,Four,In stock
644,A Clash of Kings ...,£10.79,Three,In stock
645,Vogue Colors A to ...,£52.35,Four,In stock
646,The Shining (The Shining ...,£27.88,Three,In stock
647,The Pilgrim's Progress,£50.26,Two,In stock
648,The Perfect Play (Play ...,£59.99,Three,In stock
649,The Passion of Dolssa,£28.32,Five,In stock
650,The Jazz of Physics: ...,£38.71,Three,In stock
651,The Hunger Games (The ...,£29.85,Five,In stock
652,The Hound of the ...,£14.82,Two,In stock
653,The Gunning of America: ...,£16.81,Four,In stock
654,The Geography of Bliss: ...,£28.23,Two,In stock
655,The Demonists (Demonist #1),£52.11,Two,In stock
656,The Demon Prince of ...,£27.88,Two,In stock
657,The Bone Hunters (Lexy ...,£59.71,Three,In stock
658,The Beast (Black Dagger ...,£46.08,Five,In stock
659,Some Women,£13.73,Five,In stock
660,Shopaholic Ties the Knot ...,£48.39,Five,In stock
661,Paper and Fire (The ...,£49.45,Five,In stock
662,Outlander (Outlander #1),£19.67,Five,In stock
663,Orchestra of Exiles: The ...,£12.36,Three,In stock
664,No One Here Gets ...,£20.02,Five,In stock
665,Night Shift (Night Shift ...,£12.75,Four,In stock
666,Needful Things,£47.51,Four,In stock
667,Mockingjay (The Hunger Games ...,£20.44,Four,In stock
668,Misery,£34.79,Two,In stock
669,Little Women (Little Women ...,£28.07,Four,In stock
670,It,£25.01,Three,In stock
671,Harry Potter and the ...,£13.90,Three,In stock
672,Harry Potter and the ...,£24.17,Four,In stock
673,Harry Potter and the ...,£31.63,Four,In stock
674,Harry Potter and the ...,£48.75,Five,In stock
675,Harry Potter and the ...,£14.74,One,In stock
676,Gone with the Wind,£32.49,Three,In stock
677,God Is Not Great: ...,£27.80,One,In stock
678,Girl With a Pearl ...,£26.77,One,In stock
679,"Fruits Basket, Vol. 4 ...",£50.44,Four,In stock
680,Far From True (Promise ...,£34.93,Two,In stock
681,Dark Lover (Black Dagger ...,£12.87,One,In stock
682,Confessions of a Shopaholic ...,£48.94,Two,In stock
683,Changing the Game (Play ...,£13.38,Three,In stock
684,Candide,£58.63,Three,In stock
685,Can You Keep a ...,£21.94,One,In stock
686,Atlas Shrugged,£26.58,Five,In stock
687,Animal Farm,£57.22,Three,In stock
688,A Walk to Remember,£56.43,One,In stock
689,A New Earth: Awakening ...,£55.65,Five,In stock
690,A History of God: ...,£27.62,One,In stock
691,'Salem's Lot,£49.56,Four,In stock
692,Zero History (Blue Ant ...,£34.77,One,In stock
693,Wuthering Heights,£17.73,Three,In stock
694,World War Z: An ...,£21.80,One,In stock
695,Wild: From Lost to ...,£46.02,Three,In stock
696,"Where'd You Go, Bernadette",£18.13,One,In stock
697,When You Are Engulfed ...,£30.89,Five,In stock
698,We the People: The ...,£31.95,Three,In stock
699,We Are All Completely ...,£24.04,One,In stock
700,Walk the Edge (Thunder ...,£32.36,Three,In stock
701,Voyager (Outlander #3),£21.07,Five,In stock
702,Very Good Lives: The ...,£50.66,Three,In stock
703,Vegan Vegetarian Omnivore: Dinner ...,£13.66,Two,In stock
704,"Unstuffed: Decluttering Your Home, ...",£58.09,One,In stock
705,Under the Banner of ...,£30.00,One,In stock
706,Two Boys Kissing,£32.74,Two,In stock
707,Twilight (Twilight #1),£41.93,Two,In stock
708,Twenties Girl,£42.80,Two,In stock
709,Trespassing Across America: One ...,£53.51,One,In stock
710,Three-Martini Lunch,£23.21,Three,In stock
711,"Thinking, Fast and Slow",£21.14,One,In stock
712,The Wild Robot,£56.07,Three,In stock
713,The Wicked + The ...,£14.41,Three,In stock
714,The Undomestic Goddess,£45.75,Four,In stock
715,The Travelers,£15.77,One,In stock
716,The Tipping Point: How ...,£10.02,Two,In stock
717,The Thing About Jellyfish,£48.77,One,In stock
718,The Stand,£57.86,Two,In stock
719,The Smitten Kitchen Cookbook,£23.59,One,In stock
720,The Silkworm (Cormoran Strike ...,£23.05,Five,In stock
721,"The Sandman, Vol. 3: ...",£55.55,Five,In stock
722,The Rose & the ...,£58.64,Four,In stock
723,The Road to Little ...,£23.21,One,In stock
724,The Rise of Theodore ...,£42.57,Three,In stock
725,The Restaurant at the ...,£10.92,One,In stock
726,The Rest Is Noise: ...,£34.77,One,In stock
727,The Red Tent,£35.66,Five,In stock
728,The Purpose Driven Life: ...,£37.19,Three,In stock
729,The Purest Hook (Second ...,£12.25,One,In stock
730,The Picture of Dorian ...,£29.70,Two,In stock
731,The Paris Wife,£36.80,Three,In stock
732,The Obsession,£45.43,One,In stock
733,The Nightingale,£26.26,Four,In stock
734,The New Guy (and ...,£44.92,Three,In stock
735,The Nanny Diaries (Nanny ...,£52.53,Five,In stock
736,The Name of God ...,£37.25,Two,In stock
737,The Maze Runner (The ...,£20.93,One,In stock
738,The Lover's Dictionary,£58.09,Two,In stock
739,The Lonely Ones,£43.59,Five,In stock
740,The Lean Startup: How ...,£33.92,Three,In stock
741,The Last Painting of ...,£55.55,Two,In stock
742,"The Land of 10,000 ...",£29.64,Four,In stock
743,The Infinities,£27.41,One,In stock
744,The Husband's Secret,£52.51,Five,In stock
745,The Hitchhiker's Guide to ...,£47.80,Three,In stock
746,The Guns of August,£14.54,Two,In stock
747,The Guernsey Literary and ...,£49.53,One,In stock
748,The Goldfinch,£43.58,Three,In stock
749,The Giver (The Giver ...,£12.30,One,In stock
750,The Girl with All ...,£49.47,Three,In stock
751,The Girl Who Played ...,£22.14,Two,In stock
752,The Girl Who Kicked ...,£57.48,One,In stock
753,The Exiled,£43.45,Three,In stock
754,The End of Faith: ...,£22.13,Four,In stock
755,"The Elegant Universe: Superstrings, ...",£13.03,Four,In stock
756,The Disappearing Spoon: And ...,£57.35,Five,In stock
757,The Devil Wears Prada ...,£44.29,One,In stock
758,The Demon-Haunted World: Science ...,£52.25,Four,In stock
759,The Day the Crayons ...,£26.33,Five,In stock
760,The Da Vinci Code ...,£22.96,Two,In stock
761,The Cuckoo's Calling (Cormoran ...,£19.21,One,In stock
762,The Complete Stories and ...,£26.78,Four,In stock
763,The Complete Poems,£41.32,Five,In stock
764,The Catcher in the ...,£24.55,One,In stock
765,The Cat in the ...,£16.26,Two,In stock
766,The Case for Christ ...,£47.84,One,In stock
767,The Book Thief,£53.49,Two,In stock
768,The Book of Basketball: ...,£44.84,Five,In stock
769,The Blind Side: Evolution ...,£53.71,Five,In stock
770,The Autobiography of Malcolm ...,£23.43,Two,In stock
771,The Art of Simple ...,£34.32,Three,In stock
772,The Art of Fielding,£22.10,One,In stock
773,"Surely You're Joking, Mr. ...",£25.83,Two,In stock
774,Stiff: The Curious Lives ...,£36.74,Three,In stock
775,Spilled Milk: Based on ...,£49.51,One,In stock
776,Something Borrowed (Darcy & ...,£48.96,Five,In stock
777,Something Blue (Darcy & ...,£54.62,One,In stock
778,Soldier (Talon #3),£24.72,Two,In stock
779,Shopaholic & Baby (Shopaholic ...,£46.45,Two,In stock
780,Seven Days in the ...,£52.33,Two,In stock
781,Seven Brief Lessons on ...,£30.60,Four,In stock
782,Scarlet (The Lunar Chronicles ...,£14.57,Four,In stock
783,Sarah's Key,£46.29,One,In stock
784,"Saga, Volume 3 (Saga ...",£21.57,Five,In stock
785,Running with Scissors,£12.91,Four,In stock
786,Rogue Lawyer (Rogue Lawyer ...,£50.11,Three,In stock
787,Rise of the Rocket ...,£41.67,Four,In stock
788,Rework,£44.88,Two,In stock
789,Reservations for Two,£11.10,Three,In stock
790,Red: The True Story ...,£28.54,Three,In stock
791,Ready Player One,£19.07,Four,In stock
792,Quiet: The Power of ...,£43.55,One,In stock
793,Prodigy: The Graphic Novel ...,£43.63,Three,In stock
794,Persepolis: The Story of ...,£39.13,One,In stock
795,Packing for Mars: The ...,£56.68,Two,In stock
796,Outliers: The Story of ...,£14.16,One,In stock
797,Original Fake,£31.45,Three,In stock
798,Orange Is the New ...,£24.61,Two,In stock
799,One for the Money ...,£32.87,Two,In stock
800,Notes from a Small ...,£40.17,One,In stock
801,Night (The Night Trilogy ...,£13.51,One,In stock
802,Neither Here nor There: ...,£38.95,Three,In stock
803,Naked,£31.69,Three,In stock
804,Morning Star (Red Rising ...,£29.40,One,In stock
805,Miracles from Heaven: A ...,£57.83,One,In stock
806,Midnight Riot (Peter Grant/ ...,£55.46,Two,In stock
807,Me Talk Pretty One ...,£57.60,Two,In stock
808,Manuscript Found in Accra,£34.98,Two,In stock
809,Lust & Wonder,£11.87,Two,In stock
810,Lila (Gilead #3),£12.47,Three,In stock
811,"Life, the Universe and ...",£33.26,Two,In stock
812,Life Without a Recipe,£59.04,Five,In stock
813,Life After Life,£26.13,Two,In stock
814,Letter to a Christian ...,£22.20,One,In stock
815,Let's Pretend This Never ...,£45.11,One,In stock
816,Legend (Legend #1),£43.69,Four,In stock
817,"Lean In: Women, Work, ...",£25.02,One,In stock
818,Lamb: The Gospel According ...,£55.50,Five,In stock
819,Lady Renegades (Rebel Belle ...,£53.04,Five,In stock
820,Jurassic Park (Jurassic Park ...,£44.97,One,In stock
821,It's Never Too Late ...,£42.38,One,In stock
822,Is Everyone Hanging Out ...,£20.11,Three,In stock
823,Into the Wild,£56.70,Five,In stock
824,Inferno (Robert Langdon #4),£41.00,Five,In stock
825,In the Garden of ...,£28.85,Three,In stock
826,If I Run (If ...,£49.97,Four,In stock
827,I've Got Your Number,£19.69,One,In stock
828,I Am Malala: The ...,£28.88,Two,In stock
829,Hungry Girl Clean & ...,£33.14,Three,In stock
830,House of Lost Worlds: ...,£43.70,Two,In stock
831,House of Leaves,£54.89,One,In stock
832,Horrible Bear!,£37.52,Two,In stock
833,Holidays on Ice,£51.07,Two,In stock
834,Heir to the Sky,£44.07,Four,In stock
835,Green Eggs and Ham ...,£10.79,Four,In stock
836,"Grayson, Vol 3: Nemesis ...",£42.72,One,In stock
837,Gratitude,£26.66,Five,In stock
838,Gone Girl,£37.60,Five,In stock
839,Golden (Heart of Dread ...,£42.21,Four,In stock
840,Girl in the Blue ...,£46.83,Two,In stock
841,"Fruits Basket, Vol. 3 ...",£45.17,Two,In stock
842,Friday Night Lights: A ...,£51.22,Three,In stock
843,Fire Bound (Sea Haven/Sisters ...,£21.28,Four,In stock
844,Fifty Shades Freed (Fifty ...,£15.36,Five,In stock
845,Fellside,£38.62,One,In stock
846,Extreme Prey (Lucas Davenport ...,£25.40,Three,In stock
847,Eragon (The Inheritance Cycle ...,£43.87,Three,In stock
848,Eclipse (Twilight #3),£18.74,One,In stock
849,Dune (Dune #1),£54.86,One,In stock
850,Dracula,£52.62,Three,In stock
851,Do Androids Dream of ...,£51.48,One,In stock
852,Disrupted: My Misadventure in ...,£15.28,Five,In stock
853,Dead Wake: The Last ...,£39.24,Five,In stock
854,"David and Goliath: Underdogs, ...",£17.81,One,In stock
855,Darkfever (Fever #1),£56.02,One,In stock
856,Dark Places,£23.90,Five,In stock
857,Crazy Rich Asians (Crazy ...,£49.13,Five,In stock
858,Counting Thyme,£10.62,One,In stock
859,Cosmos,£36.17,Two,In stock
860,Civilization and Its Discontents,£59.95,Two,In stock
861,Cinder (The Lunar Chronicles ...,£26.09,One,In stock
862,Catastrophic Happiness: Finding Joy ...,£37.35,Two,In stock
863,Career of Evil (Cormoran ...,£24.72,Two,In stock
864,Breaking Dawn (Twilight #4),£35.28,Five,In stock
865,Brave Enough,£51.32,Five,In stock
866,Boy Meets Boy,£21.12,Three,In stock
867,Born to Run: A ...,£27.35,Two,In stock
868,Blink: The Power of ...,£21.74,Five,In stock
869,Black Flags: The Rise ...,£40.87,One,In stock
870,"Black Butler, Vol. 1 ...",£49.31,One,In stock
871,Big Little Lies,£22.11,One,In stock
872,Between Shades of Gray,£20.79,Five,In stock
873,Best of My Love ...,£27.41,Two,In stock
874,Beowulf,£38.35,Two,In stock
875,Beautiful Creatures (Caster Chronicles ...,£21.55,Five,In stock
876,Awkward,£38.02,Two,In stock
877,Ash,£22.06,Four,In stock
878,Are We There Yet?,£10.66,Three,In stock
879,Are We Smart Enough ...,£56.58,One,In stock
880,Annie on My Mind,£36.83,Five,In stock
881,And Then There Were ...,£35.01,Two,In stock
882,A Walk in the ...,£30.48,Four,In stock
883,A Visit from the ...,£14.08,Five,In stock
884,A Storm of Swords ...,£31.22,Two,In stock
885,A Heartbreaking Work of ...,£54.29,Five,In stock
886,8 Keys to Mental ...,£31.04,One,In stock
887,#GIRLBOSS,£50.96,One,In stock
888,The Suffragettes (Little Black ...,£11.89,Two,In stock
889,The Sense of an ...,£31.38,Three,In stock
890,"The Sandman, Vol. 2: ...",£54.81,One,In stock
891,The Course of Love,£16.78,Three,In stock
892,Sugar Rush (Offensive Line ...,£24.42,One,In stock
893,"Saga, Volume 2 (Saga ...",£11.75,Three,In stock
894,"Run, Spot, Run: The ...",£20.02,One,In stock
895,New Moon (Twilight #2),£12.86,Four,In stock
896,Life,£31.58,Five,In stock
897,Kindle Paperwhite User's Guide,£34.00,Three,In stock
898,H is for Hawk,£57.42,Five,In stock
899,Girl Online On Tour ...,£53.47,One,In stock
900,"Fruits Basket, Vol. 2 ...",£11.64,Five,In stock
901,Diary of a Minecraft ...,£52.88,Four,In stock
902,"Y: The Last Man, ...",£18.51,Four,In stock
903,While You Were Mine,£41.32,Five,In stock
904,Where Lightning Strikes (Bleeding ...,£39.77,Three,In stock
905,When I'm Gone,£51.96,Three,In stock
906,Ways of Seeing,£39.51,Five,In stock
907,"Vampire Knight, Vol. 1 ...",£15.40,One,In stock
908,Vampire Girl (Vampire Girl ...,£53.82,Two,In stock
909,Twenty Love Poems and ...,£30.95,Four,In stock
910,Travels with Charley: In ...,£57.82,Five,In stock
911,Three Wishes (River of ...,£44.18,Two,In stock
912,This One Moment (Pushing ...,£48.71,One,In stock
913,The Zombie Room,£19.69,Five,In stock
914,The Wicked + The ...,£36.52,Two,In stock
915,The Tumor,£41.56,Five,In stock
916,The Story of Hong ...,£43.19,Four,In stock
917,The Silent Wife,£12.34,Five,In stock
918,The Silent Twin (Detective ...,£36.25,Three,In stock
919,The Selfish Gene,£29.45,One,In stock
920,The Secret Healer,£34.56,Three,In stock
921,"The Sandman, Vol. 1: ...",£54.12,Three,In stock
922,The Republic,£33.78,Three,In stock
923,The Odyssey,£29.64,Three,In stock
924,The No. 1 Ladies' ...,£57.70,Four,In stock
925,The Nicomachean Ethics,£36.34,One,In stock
926,The Name of the ...,£50.59,Three,In stock
927,The Mirror & the ...,£29.38,One,In stock
928,The Little Prince,£45.42,Two,In stock
929,The Light of the ...,£54.43,One,In stock
930,The Last Girl (The ...,£36.26,Two,In stock
931,The Iliad,£16.16,One,In stock
932,The Hook Up (Game ...,£36.29,Five,In stock
933,The Haters,£27.89,Five,In stock
934,The Girl You Lost,£12.29,Five,In stock
935,The Girl In The ...,£15.85,Three,In stock
936,The End of the ...,£14.40,One,In stock
937,The Edge of Reason ...,£19.18,Four,In stock
938,The Complete Maus (Maus ...,£10.64,Three,In stock
939,The Communist Manifesto,£14.76,Three,In stock
940,The Bhagavad Gita,£57.49,Three,In stock
941,The Bette Davis Club,£30.66,Three,In stock
942,The Art of Not ...,£40.83,Four,In stock
943,Taking Shots (Assassins #1),£18.88,Two,In stock
944,Starlark,£25.83,Three,In stock
945,"Skip Beat!, Vol. 01 ...",£42.12,Three,In stock
946,Sister Sable (The Mad ...,£13.33,Three,In stock
947,Shatter Me (Shatter Me ...,£42.40,One,In stock
948,Shameless,£58.35,Three,In stock
949,Shadow Rites (Jane Yellowrock ...,£21.72,Four,In stock
950,Settling the Score (The ...,£44.91,Two,In stock
951,Sense and Sensibility,£37.46,One,In stock
952,"Saga, Volume 1 (Saga ...",£28.48,One,In stock
953,"Rhythm, Chord & Malykhin",£28.34,Two,In stock
954,"Rat Queens, Vol. 1: ...",£46.96,Five,In stock
955,Paradise Lost (Paradise #1),£24.96,One,In stock
956,"Paper Girls, Vol. 1 ...",£21.71,Four,In stock
957,Ouran High School Host ...,£29.87,Three,In stock
958,Origins (Alphas 0.5),£28.99,One,In stock
959,One Second (Seven #7),£52.94,Two,In stock
960,On the Road (Duluoz ...,£32.36,Three,In stock
961,Old Records Never Die: ...,£55.66,Two,In stock
962,Off Sides (Off #1),£39.45,Five,In stock
963,Of Mice and Men,£47.11,Two,In stock
964,Myriad (Prentor #1),£58.75,Four,In stock
965,My Perfect Mistake (Over ...,£38.92,Two,In stock
966,"Ms. Marvel, Vol. 1: ...",£39.39,Four,In stock
967,Meditations,£25.89,Two,In stock
968,Matilda,£28.34,One,In stock
969,Lost Among the Living,£27.70,Four,In stock
970,Lord of the Flies,£24.89,Three,In stock
971,Listen to Me (Fusion ...,£58.99,Three,In stock
972,Kitchens of the Great ...,£57.20,Five,In stock
973,Jane Eyre,£38.43,Five,In stock
974,Imperfect Harmony,£34.74,Four,In stock
975,Icing (Aces Hockey #2),£40.44,Four,In stock
976,"Hawkeye, Vol. 1: My ...",£45.24,Three,In stock
977,Having the Barbarian's Baby ...,£34.96,Four,In stock
978,"Giant Days, Vol. 1 ...",£56.76,Four,In stock
979,"Fruits Basket, Vol. 1 ...",£40.28,Five,In stock
980,Frankenstein,£38.00,Two,In stock
981,Forever Rockers (The Rocker ...,£28.80,Three,In stock
982,Fighting Fate (Fighting #6),£39.24,Three,In stock
983,Emma,£32.93,Two,In stock
984,"Eat, Pray, Love",£51.32,Three,In stock
985,Deep Under (Walker Security ...,£47.09,Five,In stock
986,Choosing Our Religion: The ...,£28.42,Four,In stock
987,Charlie and the Chocolate ...,£22.85,Three,In stock
988,Charity's Cross (Charles Towne ...,£41.24,One,In stock
989,Bright Lines,£39.07,Five,In stock
990,Bridget Jones's Diary (Bridget ...,£29.82,One,In stock
991,Bounty (Colorado Mountain #7),£37.26,Four,In stock
992,Blood Defense (Samantha Brinkman ...,£20.30,Three,In stock
993,"Bleach, Vol. 1: Strawberry ...",£34.65,Five,In stock
994,Beyond Good and Evil,£43.38,One,In stock
995,Alice in Wonderland (Alice's ...,£55.53,One,In stock
996,"Ajin: Demi-Human, Volume 1 ...",£57.06,Four,In stock
997,A Spy's Devotion (The ...,£16.97,Five,In stock
998,1st to Die (Women's ...,£53.98,One,In stock
999,"1,000 Places to See ...",£26.08,Five,In stock
